{
  "session_id": "test-session-123",
  "project_root": "/test/project",
  "workflow_root": "/test/project/.mycelium",
  "active_workflow": "feature-development",
  "current_phase": "planning",
  "discovered_capabilities": {
    "skills": [],
    "agents": [],
    "mcps": []
  },
  "worktrees": [],
  "metadata": {
    "created_at": "2026-02-04T10:00:00Z",
    "last_updated": "2026-02-04T10:00:00Z"
  }
}
